Defect ID,Branch,Sample ID,Severity,Pipeline Stage,Issue Type,Observed Output,Expected Safer Output,Proposed Fix,Status
DEF-006,home,HOME-CONTRA-001,Medium,review-thresholds,human-review threshold miss,"Contradictory conditions (average clause in conditions + 'does not apply' in exclusions) at confidence 0.65 now correctly produce displayMode='restricted'","displayMode='restricted' when contradictions detected","Added detectConditionContradictions() to review-thresholds.ts with average_clause pattern",Fixed
DEF-007,all,All noisy samples,Low,display-interpreter,quote-link miss,"Noisy samples produce coverage cards but no source quote links (evidence.insights empty in fixtures)","Source quotes depend on LLM extraction quality","Not a pipeline defect — reflects reality. Acknowledged in readiness scorecard.",Acknowledged
DEF-008,nakliyat,NAK-CONTRA-001,Medium,review-thresholds,ICC conflict miss,"ICC (A) in coverage name + (C) in description now correctly detected as contradiction → displayMode='restricted'","Should detect ICC conflict and flag ambiguity","Added icc_conflict pattern to detectConditionContradictions()",Fixed
DEF-009,health,HEALTH-CONTRA-001,Medium,review-thresholds,copay/waiting contradiction,"Contradictory copay (%20 vs %0) and waiting period (30 days vs none) now detected → displayMode='restricted'","Should detect condition contradictions","Added copay and waiting_period patterns to detectConditionContradictions()",Fixed
DEF-010,business,BIZ-CONTRA-001,Medium,review-thresholds,BI/warranty contradiction,"Contradictory BI periods (6 vs 18 months) and alarm warranty (required vs not) now detected → displayMode='restricted'","Should detect contradictory conditions","Added bi_indemnity_conflict and alarm_warranty patterns to detectConditionContradictions()",Fixed
